<?xml version='1.0' encoding='utf-8'?>
<ns0:SMC_Praeparat xmlns:ns0="http://ccsap.bit.admin.ch/SWISSMEDIC/LIMS_HMIT_KHZ" xmlns:xsi="http://www.w3.org/2001/XMLSchema-instance" xsi:schemaLocation="http://ccsap.bit.admin.ch/SWISSMEDIC/LIMS_HMIT_KHZ https://ogd.swissmedic.ch/hmd/ZL/172/Beschreibungen/OGD-Praeparate.xsd"><PRAEPARAT><VERWENDUNG>HAM</VERWENDUNG><ZULASSUNGSNUMMER>10029</ZULASSUNGSNUMMER><PRAEPARATENAME>Zeller Herz und Nerven Classic, Tropfen zum Einnehmen</PRAEPARATENAME><ARZNEIFORM>TROF</ARZNEIFORM><ATC_CODE>C01EX</ATC_CODE><HEILMITTEL_CODE>P</HEILMITTEL_CODE><ZULASSUNGSSTATUS>Z</ZULASSUNGSSTATUS><ZULASSUNGSKATEGORIE /><ZULASSUNGSINHABERIN>1000324</ZULASSUNGSINHABERIN><ERSTZULASSUNGSDATUM>1966-02-04</ERSTZULASSUNGSDATUM><BASIS_ZULASSUNGSNUMMER /><ABGABEKATEGORIE>D</ABGABEKATEGORIE><IT_NUMMER>02.98.0.</IT_NUMMER><ANWENDUNGSGEBIET>Bei nervösen Herzbeschwerden</ANWENDUNGSGEBIET><ABLAUFDATUM>9999-12-31</ABLAUFDATUM><CHARGENFREIGABE_PFLICHT /><EINZELEINFUHR_BEWILLIG_PFLICHT /></PRAEPARAT><PRAEPARAT><VERWENDUNG>HAM</VERWENDUNG><ZULASSUNGSNUMMER>10167</ZULASSUNGSNUMMER><PRAEPARATENAME>Emser Salz, Pulver zur Herstellung einer Nasenspülung/Mundspülung/Gurgellösung oder Lösung zu Inhalation</PRAEPARATENAME><ARZNEIFORM>PULIN</ARZNEIFORM><ATC_CODE>R02AX</ATC_CODE><HEILMITTEL_CODE>S</HEILMITTEL_CODE><ZULASSUNGSSTATUS>Z</ZULASSUNGSSTATUS><ZULASSUNGSKATEGORIE /><ZULASSUNGSINHABERIN>1002610</ZULASSUNGSINHABERIN><ERSTZULASSUNGSDATUM>1934-08-31</ERSTZULASSUNGSDATUM><BASIS_ZULASSUNGSNUMMER /><ABGABEKATEGORIE>D</ABGABEKATEGORIE><IT_NUMMER>12.03.9.</IT_NUMMER><ANWENDUNGSGEBIET>Katarrhalische Erkrankungen der Atemwege</ANWENDUNGSGEBIET><ABLAUFDATUM>9999-12-31</ABLAUFDATUM><CHARGENFREIGABE_PFLICHT /><EINZELEINFUHR_BEWILLIG_PFLICHT /></PRAEPARAT><PRAEPARAT><VERWENDUNG>HAM</VERWENDUNG><ZULASSUNGSNUMMER>30514</ZULASSUNGSNUMMER><PRAEPARATENAME>Spersadex comp., collyre en solution</PRAEPARATENAME><ARZNEIFORM>AUL</ARZNEIFORM><ATC_CODE>S01CA01</ATC_CODE><HEILMITTEL_CODE>S</HEILMITTEL_CODE><ZULASSUNGSSTATUS>D</ZULASSUNGSSTATUS><ZULASSUNGSKATEGORIE /><ZULASSUNGSINHABERIN>1001056</ZULASSUNGSINHABERIN><ERSTZULASSUNGSDATUM>1964-05-19</ERSTZULASSUNGSDATUM><BASIS_ZULASSUNGSNUMMER /><ABGABEKATEGORIE>A</ABGABEKATEGORIE><IT_NUMMER>11.06.1.</IT_NUMMER><ANWENDUNGSGEBIET>Infizierte Augenentzündungen</ANWENDUNGSGEBIET><ABLAUFDATUM>2026-07-17</ABLAUFDATUM><CHARGENFREIGABE_PFLICHT /><EINZELEINFUHR_BEWILLIG_PFLICHT /></PRAEPARAT><PRAEPARAT><VERWENDUNG>HAM</VERWENDUNG><ZULASSUNGSNUMMER>32238</ZULASSUNGSNUMMER><PRAEPARATENAME>Tannosynt flüssig, Konzentrat zur Herstellung einer Lösung zur Anwendung auf der Haut</PRAEPARATENAME><ARZNEIFORM>BAD</ARZNEIFORM><ATC_CODE>D11AX</ATC_CODE><HEILMITTEL_CODE>S</HEILMITTEL_CODE><ZULASSUNGSSTATUS>D</ZULASSUNGSSTATUS><ZULASSUNGSKATEGORIE /><ZULASSUNGSINHABERIN>1002404</ZULASSUNGSINHABERIN><ERSTZULASSUNGSDATUM>1966-05-23</ERSTZULASSUNGSDATUM><BASIS_ZULASSUNGSNUMMER /><ABGABEKATEGORIE>D</ABGABEKATEGORIE><IT_NUMMER>10.08.0.</IT_NUMMER><ANWENDUNGSGEBIET>Entzündliche, nässende und juckende Hauterkrankungen</ANWENDUNGSGEBIET><ABLAUFDATUM>2026-07-22</ABLAUFDATUM><CHARGENFREIGABE_PFLICHT /><EINZELEINFUHR_BEWILLIG_PFLICHT /></PRAEPARAT><PRAEPARAT><VERWENDUNG>TAM</VERWENDUNG><ZULASSUNGSNUMMER>90001</ZULASSUNGSNUMMER><PRAEPARATENAME>Fixture Vet Drops, Tropfen zum Einnehmen</PRAEPARATENAME><ARZNEIFORM>TROF</ARZNEIFORM><ATC_CODE>QJ01CA04</ATC_CODE><HEILMITTEL_CODE>P</HEILMITTEL_CODE><ZULASSUNGSSTATUS>Z</ZULASSUNGSSTATUS><ZULASSUNGSKATEGORIE /><ZULASSUNGSINHABERIN>1000324</ZULASSUNGSINHABERIN><ERSTZULASSUNGSDATUM>2020-01-01</ERSTZULASSUNGSDATUM><BASIS_ZULASSUNGSNUMMER /><ABGABEKATEGORIE>D</ABGABEKATEGORIE><IT_NUMMER>02.98.0.</IT_NUMMER><ANWENDUNGSGEBIET>Veterinary fixture product</ANWENDUNGSGEBIET><ABLAUFDATUM>9999-12-31</ABLAUFDATUM><CHARGENFREIGABE_PFLICHT /><EINZELEINFUHR_BEWILLIG_PFLICHT /></PRAEPARAT></ns0:SMC_Praeparat>